{
  "schemaVersion": 1,
  "policyVersion": "2026-08-01",
  "revenueCat": {
    "canonicalProEntitlementId": "archive_loop_pro",
    "acceptedLegacyEntitlementAliases": ["pro"],
    "legacyGrandfatheredProductIds": ["archive_loop_pro_lifetime"],
    "currentOfferingPackageKinds": ["monthly", "annual"],
    "blockedCurrentPackageKinds": ["lifetime"]
  },
  "plans": [
    { "id": "free", "kind": "free" },
    { "id": "pro_subscription", "kind": "pro" },
    {
      "id": "legacy_grandfathered",
      "kind": "legacyGrandfathered",
      "availableForNewPurchase": false
    }
  ],
  "subscriptionStates": [
    "free",
    "trial",
    "active",
    "gracePeriod",
    "billingIssue",
    "expired",
    "revoked",
    "legacyGrandfathered",
    "unknown"
  ],
  "customerFacingCopy": {
    "originalsStayYours": "Your recordings stay yours.",
    "existingResultsStayReadable": "Observations and comparisons already created remain available.",
    "firstObservationIncluded": "Your first valid evidence-backed observation is included.",
    "firstComparisonIncluded": "Your first valid two-moment comparison is included.",
    "ongoingComparisons": "Ongoing comparisons",
    "fullChangesHistory": "Full Changes history generation",
    "deeperArchiveAnalysis": "Deeper archive analysis",
    "fullHistoryQuestions": "Full-history questions",
    "periodicReviews": "Periodic reviews",
    "advancedEvidenceGrouping": "Advanced evidence grouping",
    "remoteTranscriptionAllowance": "Additional configured remote transcription",
    "remoteAnalysisAllowance": "Additional configured remote analysis",
    "restorePurchases": "Restore Purchases",
    "paywallHeadline": "Keep following what changes.",
    "paywallSupportingLine": "Your recordings stay yours. Pro unlocks ongoing comparisons and deeper archive analysis."
  },
  "capabilities": [
    {
      "id": "createTypedEntry",
      "accessClass": "userOwned",
      "expiryBehaviour": "alwaysAvailable",
      "offlineBehaviour": "allowed",
      "copyKey": "originalsStayYours"
    },
    {
      "id": "createVoiceRecording",
      "accessClass": "userOwned",
      "expiryBehaviour": "alwaysAvailable",
      "offlineBehaviour": "allowed",
      "copyKey": "originalsStayYours"
    },
    {
      "id": "openOriginalEntry",
      "accessClass": "userOwned",
      "expiryBehaviour": "alwaysAvailable",
      "offlineBehaviour": "allowed",
      "copyKey": "originalsStayYours"
    },
    {
      "id": "readSavedTranscript",
      "accessClass": "userOwned",
      "expiryBehaviour": "alwaysAvailable",
      "offlineBehaviour": "allowed",
      "copyKey": "originalsStayYours"
    },
    {
      "id": "editOriginalContent",
      "accessClass": "userOwned",
      "expiryBehaviour": "alwaysAvailable",
      "offlineBehaviour": "allowed",
      "copyKey": "originalsStayYours"
    },
    {
      "id": "playOriginalAudio",
      "accessClass": "userOwned",
      "expiryBehaviour": "alwaysAvailable",
      "offlineBehaviour": "allowed",
      "copyKey": "originalsStayYours"
    },
    {
      "id": "browseOriginalArchive",
      "accessClass": "userOwned",
      "expiryBehaviour": "alwaysAvailable",
      "offlineBehaviour": "allowed",
      "copyKey": "originalsStayYours"
    },
    {
      "id": "basicLocalSearch",
      "accessClass": "userOwned",
      "expiryBehaviour": "alwaysAvailable",
      "offlineBehaviour": "allowed",
      "copyKey": "originalsStayYours"
    },
    {
      "id": "openEvidenceSource",
      "accessClass": "userOwned",
      "expiryBehaviour": "alwaysAvailable",
      "offlineBehaviour": "allowed",
      "copyKey": "originalsStayYours"
    },
    {
      "id": "correctInterpretation",
      "accessClass": "userOwned",
      "expiryBehaviour": "alwaysAvailable",
      "offlineBehaviour": "allowed",
      "copyKey": "originalsStayYours"
    },
    {
      "id": "hideInterpretation",
      "accessClass": "userOwned",
      "expiryBehaviour": "alwaysAvailable",
      "offlineBehaviour": "allowed",
      "copyKey": "originalsStayYours"
    },
    {
      "id": "deleteOriginalContent",
      "accessClass": "userOwned",
      "expiryBehaviour": "alwaysAvailable",
      "offlineBehaviour": "allowed",
      "copyKey": "originalsStayYours"
    },
    {
      "id": "exportOriginalContent",
      "accessClass": "userOwned",
      "expiryBehaviour": "alwaysAvailable",
      "offlineBehaviour": "allowed",
      "copyKey": "originalsStayYours"
    },
    {
      "id": "downloadExistingCloudContent",
      "accessClass": "userOwned",
      "expiryBehaviour": "alwaysAvailable",
      "offlineBehaviour": "requiresConnection",
      "copyKey": "originalsStayYours"
    },
    {
      "id": "deleteCloudContent",
      "accessClass": "userOwned",
      "expiryBehaviour": "alwaysAvailable",
      "offlineBehaviour": "requiresConnection",
      "copyKey": "originalsStayYours"
    },
    {
      "id": "accountDeletion",
      "accessClass": "userOwned",
      "expiryBehaviour": "alwaysAvailable",
      "offlineBehaviour": "requiresConnection",
      "copyKey": "originalsStayYours"
    },
    {
      "id": "privacySettings",
      "accessClass": "userOwned",
      "expiryBehaviour": "alwaysAvailable",
      "offlineBehaviour": "allowed",
      "copyKey": "originalsStayYours"
    },
    {
      "id": "purchaseRestoreAndManagement",
      "accessClass": "userOwned",
      "expiryBehaviour": "alwaysAvailable",
      "offlineBehaviour": "requiresConnection",
      "copyKey": "restorePurchases"
    },
    {
      "id": "accessLegalAndSupport",
      "accessClass": "userOwned",
      "expiryBehaviour": "alwaysAvailable",
      "offlineBehaviour": "allowedWhenLocal",
      "copyKey": "originalsStayYours"
    },
    {
      "id": "readExistingGeneratedOutput",
      "accessClass": "userOwned",
      "expiryBehaviour": "readOnlyAfterExpiry",
      "offlineBehaviour": "allowed",
      "copyKey": "existingResultsStayReadable"
    },
    {
      "id": "firstEvidenceObservation",
      "accessClass": "freeProof",
      "expiryBehaviour": "readOnlyAfterGeneration",
      "offlineBehaviour": "allowedWhenLocal",
      "copyKey": "firstObservationIncluded"
    },
    {
      "id": "remoteObservationGeneration",
      "accessClass": "metered",
      "expiryBehaviour": "planAllowanceAfterExpiry",
      "offlineBehaviour": "requiresConnection",
      "usageMeterId": "remoteObservationGeneration",
      "copyKey": "remoteAnalysisAllowance"
    },
    {
      "id": "firstEarlyComparison",
      "accessClass": "freeProof",
      "expiryBehaviour": "readOnlyAfterGeneration",
      "offlineBehaviour": "allowedWhenLocal",
      "copyKey": "firstComparisonIncluded"
    },
    {
      "id": "ongoingComparisons",
      "accessClass": "proMetered",
      "expiryBehaviour": "noNewGenerationAfterExpiry",
      "offlineBehaviour": "requiresConnection",
      "usageMeterId": "ongoingComparisonGeneration",
      "copyKey": "ongoingComparisons"
    },
    {
      "id": "fullChangesHistoryGeneration",
      "accessClass": "proMetered",
      "expiryBehaviour": "noNewGenerationAfterExpiry",
      "offlineBehaviour": "requiresConnection",
      "usageMeterId": "ongoingComparisonGeneration",
      "copyKey": "fullChangesHistory"
    },
    {
      "id": "deepArchiveSynthesis",
      "accessClass": "proMetered",
      "expiryBehaviour": "noNewGenerationAfterExpiry",
      "offlineBehaviour": "requiresConnection",
      "usageMeterId": "deepArchiveSynthesis",
      "copyKey": "deeperArchiveAnalysis"
    },
    {
      "id": "fullHistoryQuestion",
      "accessClass": "proMetered",
      "expiryBehaviour": "noNewGenerationAfterExpiry",
      "offlineBehaviour": "requiresConnection",
      "usageMeterId": "archiveQuestion",
      "copyKey": "fullHistoryQuestions"
    },
    {
      "id": "periodicReviewGeneration",
      "accessClass": "proMetered",
      "expiryBehaviour": "noNewGenerationAfterExpiry",
      "offlineBehaviour": "requiresConnection",
      "usageMeterId": "periodicReview",
      "copyKey": "periodicReviews"
    },
    {
      "id": "advancedEvidenceGrouping",
      "accessClass": "pro",
      "expiryBehaviour": "noNewGenerationAfterExpiry",
      "offlineBehaviour": "allowedWhenLocal",
      "copyKey": "advancedEvidenceGrouping"
    },
    {
      "id": "remoteTranscription",
      "accessClass": "metered",
      "expiryBehaviour": "planAllowanceAfterExpiry",
      "offlineBehaviour": "requiresConnection",
      "usageMeterId": "remoteTranscriptionSeconds",
      "copyKey": "remoteTranscriptionAllowance"
    },
    {
      "id": "embeddingGeneration",
      "accessClass": "metered",
      "expiryBehaviour": "planAllowanceAfterExpiry",
      "offlineBehaviour": "requiresConnection",
      "usageMeterId": "embeddingGeneration",
      "copyKey": "remoteAnalysisAllowance"
    }
  ],
  "usageMeters": [
    {
      "id": "remoteTranscriptionSeconds",
      "unit": "seconds",
      "period": "billingPeriod",
      "productionConfigurationRequired": true
    },
    {
      "id": "remoteObservationGeneration",
      "unit": "requests",
      "period": "billingPeriod",
      "productionConfigurationRequired": true
    },
    {
      "id": "earlyComparisonGeneration",
      "unit": "requests",
      "period": "billingPeriod",
      "productionConfigurationRequired": true
    },
    {
      "id": "ongoingComparisonGeneration",
      "unit": "requests",
      "period": "billingPeriod",
      "productionConfigurationRequired": true
    },
    {
      "id": "deepArchiveSynthesis",
      "unit": "requests",
      "period": "billingPeriod",
      "productionConfigurationRequired": true
    },
    {
      "id": "archiveQuestion",
      "unit": "requests",
      "period": "billingPeriod",
      "productionConfigurationRequired": true
    },
    {
      "id": "periodicReview",
      "unit": "requests",
      "period": "billingPeriod",
      "productionConfigurationRequired": true
    },
    {
      "id": "embeddingGeneration",